batch_rank,title,organization,org_type,composite_score,iaps_alignment,policy_specificity,evidence_base,political_viability,reasoning,row_index
1,Focus OSINT on China's AI ecosystem,Center for Security and Emerging Technology,Think Tank,9.2,10.0,9.0,9.0,8.5,"Highly aligned with IAPS's focus on international AI governance and national security, specifically targeting China's AI ecosystem. Concrete, actionable recommendation for a federal OSINT program with clear implementation path and strong evidence base. Politically viable given bipartisan concern about China.",5071
2,Support the NIST AI Safety Institute,Federation of American Scientists,Think Tank,8.85,10.0,8.5,8.5,8.0,"Directly supports the NIST AI Safety Institute, a core IAPS policy area. Concrete call for codification and prioritization, with bipartisan support and clear implementation mechanisms. Strong evidence base and high feasibility.",5016
3,Develop and adopt AI risk standards,Center for Security and Emerging Technology,Think Tank,8.475,9.5,8.5,8.0,7.5,"Specific, actionable standards for AI risk mitigation, with clear implementation via AISI and federal procurement. Strong alignment with IAPS's standards/governance focus. Evidence-based and feasible.",5032
4,Define capabilities of concern for biosecurity,Center for Security and Emerging Technology,Think Tank,8.225,9.0,8.5,8.0,7.0,"Concrete, actionable recommendation to define 'capabilities of concern' for biosecurity, with reference to existing frameworks. Strong alignment with IAPS's risk governance and dual-use concerns.",4935
5,Critical Materials Supply Chain Security,Alvarez & Marshall Federal LLC,Industry (Other),7.95,8.5,8.0,8.0,7.0,"Addresses critical AI hardware supply chain security with specific mechanisms (national strategy, reserve, international partnerships). Strong national security and governance alignment.",5046
6,Implement Time-Based Export Controls for AI Technologies,"Advanced Robotics for Manufacturing
  Institute",Think Tank,7.6,8.5,7.5,7.5,6.5,"Specific export control mechanism (time-based exclusivity) for dual-use AI. Strong IAPS alignment, though implementation may face industry pushback.",4983
7,Attract and retain AI entrepreneurs and AI researchers,Center for Security and Emerging Technology,Think Tank,7.525,8.0,7.5,7.0,7.5,"Concrete immigration policy changes to attract/retain AI talent. Well-specified, evidence-based, and politically feasible within executive authority.",4926
8,Accelerate Federal Government AI Adoption,OpenAI,Frontier Developer,7.300000000000001,8.0,7.0,7.0,7.0,Addresses government AI adoption barriers with specific regulatory/process reforms. Moderate IAPS alignment (governance/implementation focus).,4982
9,Increase researcher access to DOE's AI facilities,Bipartisan Policy Center,Think Tank,7.15,7.5,7.0,7.0,7.0,"Expanding researcher access to DOE/NSF AI facilities is concrete, actionable, and evidence-based. Supports national competitiveness and innovation.",4915
10,Develop Fair IP Licensing Frameworks for Government-Funded AI,"Advanced Robotics for Manufacturing
  Institute",Think Tank,7.025,7.5,7.0,6.5,7.0,"Specific proposal for fair IP licensing of government-funded AI, balancing openness and security. Aligned with IAPS's governance focus.",5037
11,Establish Guidelines for AI Procurement in Government,"CGI Federal, Inc.",Industry (Other),6.875,7.0,7.0,6.5,7.0,Concrete recommendations for AI procurement reform in government. Aligned with IAPS's implementation and governance interests.,5125
12,Prioritize Commercial AI Solutions for Government,Information Technology Industry Council,Industry Association,6.75,7.0,6.5,6.5,7.0,"Encourages use of existing commercial procurement tools for AI. Specific, actionable, and feasible, though not highly innovative.",4995
13,Develop comprehensive AI security policies,Microsoft,Frontier Developer,6.5249999999999995,7.0,6.5,6.0,6.5,"Calls for comprehensive AI security policies across the stack. Somewhat vague, but aligns with IAPS's security focus.",4812
14,Develop and Implement Cybersecurity Measures for AI Technologies,"CGI Federal, Inc.",Industry (Other),6.5249999999999995,7.0,6.5,6.0,6.5,Concrete call for AI-specific cybersecurity measures and a national task force. Moderate IAPS alignment.,4901
15,Promote the creation and expansion of open data commons,Microsoft,Frontier Developer,6.375,6.5,6.5,6.0,6.5,"Promoting open data commons is actionable and supports AI research, but lacks direct alignment with IAPS's core priorities.",4765
16,Develop Guidelines for AI-Generated Intellectual Property,"CGI Federal, Inc.",Industry (Other),6.25,6.5,6.0,6.0,6.5,"Developing guidelines for AI-generated IP is concrete and relevant, but lacks detail on enforcement or standards.",5050
17,Invest in Manufacturing Infrastructure and Supply Chains,"Advanced Robotics for Manufacturing
  Institute",Think Tank,6.25,6.5,6.0,6.0,6.5,"Funding for manufacturing infrastructure is actionable and relevant for AI hardware, but lacks detail and direct governance focus.",5134
18,Update laws on child sexual exploitation and non-consensual imagery,Microsoft,Frontier Developer,6.325,6.0,6.5,6.0,7.0,"Updating laws on AI-generated child sexual exploitation imagery is specific, actionable, and politically viable, but not a core IAPS focus.",5079
19,Streamline federal permitting for datacenters and energy infrastructure,Microsoft,Frontier Developer,6.1,6.0,6.0,6.0,6.5,"Streamlining permitting for datacenters/energy infrastructure is actionable and relevant for AI compute, but not a direct governance issue.",5092
20,Foster collaboration on AI security,Microsoft,Frontier Developer,5.75,6.0,5.5,5.5,6.0,"Vague call for collaboration on AI security. Lacks specificity, but aligns with IAPS's interest in security best practices.",5106
21,Accelerate AI R&D and resources for researchers,Google,Frontier Developer,5.75,6.0,5.5,5.5,6.0,"Broad call for increased AI R&D funding and access. Actionable, but largely duplicative of current efforts and lacks governance focus.",4904
22,Establish federal programs for on-the-job AI training,Microsoft,Frontier Developer,5.6000000000000005,5.5,5.5,5.5,6.0,"On-the-job AI training is concrete and feasible, but not directly related to IAPS's governance or security priorities.",4767
23,Teacher Workforce Development for the AI Era,Federation of American Scientists,Think Tank,5.6000000000000005,5.5,5.5,5.5,6.0,"Teacher workforce development for AI is actionable and evidence-based, but not a core IAPS priority.",4788
24,Promote Awareness of Manufacturing USA Resources,"Advanced Robotics for Manufacturing
  Institute",Think Tank,5.3500000000000005,5.5,5.0,5.0,6.0,Promoting awareness of manufacturing resources is concrete but marginal for AI governance.,5002
25,Balance Open-Source AI Innovation with Security,Information Technology Industry Council,Industry Association,5.375,5.5,5.0,5.5,5.5,"Balanced discussion of open-source AI and security, referencing NTIA report. Lacks concrete policy recommendations.",5164
26,Develop a Forward-Looking AI Regulatory Framework,"CGI Federal, Inc.",Industry (Other),5.1,5.0,5.0,5.0,5.5,Vague call for a national AI governance body and adaptive mechanisms. Lacks detail and implementation path.,5104
27,Encourage Responsible AI Governance by Tech Firms,Wahba Institute for Strategic Competition,Think Tank,4.6,4.5,4.5,4.5,5.0,Voluntary AI safety frameworks are vague and lack enforcement. Repeats industry talking points.,4918
28,"Implement ""AI Education for All"" Program",INCOMPAS,Industry Association,4.6,4.5,4.5,4.5,5.0,K-12 AI education is broad and lacks specificity. Not aligned with IAPS's governance/security focus.,4772
29,Develop Focused Workforce Development Programs,INCOMPAS,Industry Association,4.475,4.5,4.0,4.5,5.0,Workforce development programs are generic and lack actionable detail.,4847
30,Preemption Framework for Voluntary Federal-Private Partnership,OpenAI,Frontier Developer,4.1000000000000005,4.0,4.0,4.0,4.5,Voluntary federal-private partnership for regulatory preemption is self-serving and vague. Lacks clear governance benefit.,4952
31,Pass Comprehensive Federal Privacy Legislation,Information Technology Industry Council,Industry Association,4.1000000000000005,4.0,4.0,4.0,4.5,Generic call for federal privacy law. Lacks specificity and is a longstanding industry wish.,4792
32,Support federal privacy legislation,Microsoft,Frontier Developer,4.1000000000000005,4.0,4.0,4.0,4.5,Another generic call for privacy legislation. Lacks detail and is self-serving.,4887
33,Establish Clear Guidelines for Data Usage,HPE,Industry (Other),3.5999999999999996,3.5,3.5,3.5,4.0,Vague call for data usage guidelines. No detail or implementation path.,4910
34,Support Efficient Data Center Operations,Information Technology Industry Council,Industry Association,3.5999999999999996,3.5,3.5,3.5,4.0,Industry wish list for data center operations. Lacks governance focus and is self-serving.,4832
35,Accelerate Authorization Process for Government AI Adoption,Information Technology Industry Council,Industry Association,3.1,3.0,3.0,3.0,3.5,Vague call for accelerated government AI adoption. Lacks specifics and is industry self-interest.,4834
36,Foster Competitive AI Markets,Wahba Institute for Strategic Competition,Think Tank,2.6,2.5,2.5,2.5,3.0,Generic deregulatory rhetoric about 'competitive AI markets.' No substance or implementation path.,4879
37,Use AI to Improve Energy Systems,INCOMPAS,Industry Association,2.1,2.0,2.0,2.0,2.5,"Vague, aspirational statements about AI for energy systems. Lacks policy content or specificity.",4871
38,Withdraw BIS Interim Final Rule on AI Diffusion,Information Technology Industry Council,Industry Association,1.0,1.0,1.0,1.0,1.0,"Pure corporate lobbying to withdraw BIS rule on AI diffusion. No public interest, no evidence, no alignment with IAPS.",4976
