batch_rank,title,organization,org_type,composite_score,iaps_alignment,policy_specificity,evidence_base,political_viability,reasoning,row_index
1,Identify Critical AI Technologies for Export Control,"Advanced Robotics for Manufacturing
  Institute",Think Tank,8.675,9.5,8.5,8.0,8.5,"Directly advances IAPS priorities on export controls and national security. Proposes concrete identification and regulation of critical AI technologies, with clear agency action and precedent. Highly actionable and politically feasible.",2005
2,Establish Government Authority to Temporarily Suspend Unsafe AI Systems,Wahba Institute for Strategic Competition,Think Tank,8.424999999999999,9.0,8.5,8.0,8.0,"Concrete, actionable mechanism for government intervention in unsafe AI systems, directly aligned with IAPS's focus on AI safety governance. Cites regulatory models (NHTSA recalls), considers real-world constraints.",2219
3,AI Model Integrity Framework,Alvarez & Marshall Federal LLC,Industry (Other),8.075,9.0,8.0,7.5,7.5,"Specific, technical proposal for AI model integrity, including standards, cryptographic verification, and a national registry. Directly advances IAPS's interest in AI assurance and governance frameworks.",2077
4,AI Compute Access Program,Alvarez & Marshall Federal LLC,Industry (Other),7.925,8.5,8.0,7.5,7.5,"Concrete compute governance proposal: AI compute credits, federal resource allocation, procurement reform. Directly addresses IAPS's compute policy focus, with clear implementation path.",2238
5,Establish AI procurement and regulatory guidelines,NSF Center of Excellence,Academia,7.575,8.5,7.5,7.0,7.0,"Proposes actionable procurement/regulatory guidelines, export controls, and international collaboration. Strong alignment with IAPS priorities, though some elements are broad.",2213
6,Influence International AI Standards,Wahba Institute for Strategic Competition,Think Tank,7.575,8.5,7.0,7.5,7.0,"Focuses on US leadership in international AI standards and export controls. Actionable, with clear strategic rationale and evidence of global competition.",2229
7,Establish comprehensive AI regulations and frameworks,"Center for Intelligence, Research, Analysis, and Training (CIRAT)/Mercyhurst University",Academia,7.550000000000001,8.0,7.5,7.5,7.0,"Comprehensive regulatory framework modeled on the EU AI Act, with risk-based classification, compliance, and enforcement. Concrete, though some adaptation for US context needed.",2099
8,Foster dynamic and competitive AI markets,Center for Security and Emerging Technology,Think Tank,7.300000000000001,8.0,7.0,7.0,7.0,"Addresses market concentration and competition, a real gap in US AI policy. Proposes lowering barriers for new entrants, which is actionable and strategically important.",2142
9,Encourage secure deployment of open-source AI over blanket bans,"R Street Institute's Cybersecurity and
  Emerging Threats Team",AI Company,7.425000000000001,8.0,7.5,7.0,7.0,"Concrete, evidence-based recommendations for secure open-source AI deployment, referencing real incidents. Balances innovation and risk, aligned with IAPS's nuanced approach.",2085
10,Delegate sector-specific AI regulation to appropriate federal agencies,Healthcare Trust Institute,Think Tank,7.425000000000001,8.0,7.5,7.0,7.0,"Delegates sector-specific AI regulation to agencies with subject-matter expertise. Practical, implementable, and avoids one-size-fits-all approaches.",2169
11,Pursue Proactive AI Diplomacy,AI Alliance,Industry Association,7.15,7.5,7.0,7.0,7.0,"Proactive AI diplomacy to shape global standards aligns with IAPS's international governance focus. Somewhat broad, but actionable and timely.",2124
12,Establish AI and Robotics Testing Facilities,"Advanced Robotics for Manufacturing
  Institute",Think Tank,7.05,7.5,7.0,7.0,6.5,"Establishes real-world AI/robotics test facilities for safety and collaboration. Concrete, actionable, and supports national competitiveness.",2138
13,Develop Secure AI Models for National Security,HPE,Industry (Other),7.025,7.5,7.0,6.5,7.0,"Developing secure AI models for defense is highly aligned with IAPS's national security focus. Somewhat generic, but actionable and feasible.",2172
14,"Invest in high-risk, high-reward emerging technologies",IEEE,Professional Society,6.875,7.0,7.0,6.5,7.0,"Concrete funding and programmatic recommendations for high-risk AI research, including defense and national security applications. Some elements are speculative, but overall actionable.",2006
15,Streamline key infrastructure buildout support for AI Energy Zones,Bipartisan Policy Center,Think Tank,6.875,7.0,7.0,6.5,7.0,"Addresses a real bottleneck: data center buildout for AI. Proposes federal streamlining and incentives, with ongoing stakeholder engagement. Actionable and timely.",2250
16,AI-Driven Materials Discovery at DOE,Federation of American Scientists,Think Tank,6.7749999999999995,7.0,6.5,7.0,6.5,"DOE-led AI-driven materials discovery is concrete, leverages US strengths, and fills a strategic gap. Implementation path is clear.",2140
17,Supporting innovation through public AI infrastructure,Engineering Biology Research Consortium,Nonprofit (Other),6.6499999999999995,7.0,6.5,6.5,6.5,"Public AI infrastructure/data centers for science and innovation. Actionable, addresses compute access, and supports US competitiveness.",2068
18,Fund AI and Emerging Technology Research,Wahba Institute for Strategic Competition,Think Tank,6.7749999999999995,7.0,6.5,7.0,6.5,"Concrete call for full funding of AI R&D under the CHIPS Act, with evidence of global competition. Actionable and strategically important.",2058
19,Support long-term AI R&D programs that fill private sector gaps,Bipartisan Policy Center,Think Tank,6.6499999999999995,7.0,6.5,6.5,6.5,"Long-term AI R&D funding to fill private sector gaps, especially via DOE. Actionable, evidence-based, and aligned with IAPS's innovation focus.",2079
20,Support AI Infrastructure Globally,Wahba Institute for Strategic Competition,Think Tank,6.6499999999999995,7.0,6.5,6.5,6.5,"Promotes US AI infrastructure abroad to counter China's Digital Silk Road. Actionable, with clear mechanisms (DFC, Ex-Im Bank).",2147
21,Establish AI procurement and regulatory guidelines,NSF Center of Excellence,Academia,6.5249999999999995,7.0,6.5,6.0,6.5,"AI procurement/regulatory guidelines, export controls, and international agreements. Somewhat broad, but includes concrete elements.",2213
22,Create standard pathways to contest AI results,Center for Security and Emerging Technology,Think Tank,6.5,6.5,6.5,6.5,6.5,"Standard pathways to contest AI results are actionable, address real risks, and can be implemented through existing agencies.",2017
23,Enhance Government-to-Government Consultation with Tribal Nations,National Congress of American Indians,Advocacy Org,6.5,6.5,6.5,6.5,6.5,"Concrete recommendations for improving Tribal consultation in AI policy. Actionable, with precedent in federal consultation frameworks.",2171
24,Trusted GovTech Marketplaces,Vanta,Industry (Other),6.375,6.5,6.5,6.0,6.5,Trusted GovTech marketplaces for rapid AI procurement are actionable and address a real government bottleneck. Some implementation complexity.,2182
25,AI Compute Access Program,Alvarez & Marshall Federal LLC,Industry (Other),6.375,6.5,6.5,6.0,6.5,"AI compute access program democratizes compute, with clear implementation path (NSF, merit-based review). Addresses real gap.",2238
26,Upgrade Data Centers for AI Workloads,HPE,Industry (Other),6.25,6.5,6.0,6.0,6.5,"Upgrading data centers for AI workloads is actionable and necessary for US competitiveness. Somewhat generic, but implementation path is clear.",2176
27,Implement comprehensive AI risk assessment and governance framework,American Chemistry Council,Industry Association,6.15,6.5,6.0,6.0,6.0,"Comprehensive risk assessment and governance framework for AI. Somewhat broad, but addresses real gaps and is actionable.",2209
28,"Expand Federal Investment in Modular, Credential-Based AI Training",AI Applied Consortium,Industry Association,6.0,6.0,6.0,6.0,6.0,"Modular, credential-based AI training is actionable, evidence-based, and addresses workforce needs. Not a core IAPS focus, but relevant.",2248
29,Ban non-consensual deepfake pornography,Americans for Responsible Innovation,Advocacy Org,6.0,6.0,6.0,6.0,6.0,"Ban on non-consensual deepfake pornography is concrete, actionable, and addresses a real harm. Includes technical recommendations for detection.",2215
30,Enforce copyright fair use for AI training,Microsoft,Frontier Developer,6.0,6.0,6.0,6.0,6.0,"Enforce copyright fair use for AI training. Actionable, addresses real legal uncertainty, and has precedent.",2100
31,Ensure access to data for fair learning,Google,Frontier Developer,6.0,6.0,6.0,6.0,6.0,Balanced copyright/data access for AI training is actionable and evidence-based. Addresses a real bottleneck for AI innovation.,2087
32,Increase domestic manufacturing of energy infrastructure,Microsoft,Frontier Developer,6.0,6.0,6.0,6.0,6.0,"Increase domestic manufacturing of energy infrastructure is actionable, with clear economic rationale. Not core to IAPS, but relevant for AI infrastructure.",2233
33,Prioritize continuous AI upskilling programs,Dcode,Industry (Other),5.7250000000000005,5.5,6.0,5.5,6.0,Continuous AI upskilling programs leveraging private sector expertise are actionable and address workforce needs. Not a core IAPS focus.,2203
34,Establish the AI Workforce Resilience Program,Joint Center for Political and Economic Studies,Think Tank,5.7250000000000005,5.5,6.0,5.5,6.0,"AI Workforce Resilience Program is actionable, with clear implementation steps. Not a core IAPS priority, but relevant for economic stability.",2181
35,Develop National AI Guidelines with Human-Centered Approach,AI in Education at Oxford University,Academia,5.6000000000000005,5.5,5.5,5.5,6.0,"National AI guidelines with human-centered approach are broad, but include some actionable elements (digital infrastructure, inclusion).",2139
36,Incorporate Fairness Metrics in AI Systems,National Fair Housing Alliance,Advocacy Org,5.6000000000000005,5.5,5.5,5.5,6.0,"Fairness metrics in AI systems are actionable in some sectors, with existing frameworks cited. Not a core IAPS focus, but relevant.",2141
37,Promote Data Center Sustainability,National Fair Housing Alliance,Advocacy Org,5.6000000000000005,5.5,5.5,5.5,6.0,"Data center sustainability is actionable and relevant for AI infrastructure. Not a core IAPS focus, but addresses real-world constraints.",2188
38,Enhance labor market insights for AI workforce,Microsoft,Frontier Developer,5.6000000000000005,5.5,5.5,5.5,6.0,Enhancing labor market insights for AI workforce is actionable and evidence-based. Not a core IAPS priority.,2101
39,Prioritize Consensus Standards Over Third-Party Evaluators,AdvaMed,Industry Association,5.6000000000000005,5.5,5.5,5.5,6.0,"Prioritizes consensus standards over third-party evaluators in healthcare AI. Actionable, but sector-specific and not central to IAPS.",2206
40,Develop AI-enhanced skill acquisition and knowledge dissemination,University of Notre Dame,Academia,5.6000000000000005,5.5,5.5,5.5,6.0,AI-enhanced skill acquisition and knowledge dissemination is actionable and relevant for workforce development. Not a core IAPS priority.,2177
41,Create Centers of AI Acceleration,IEEE,Professional Society,5.6000000000000005,5.5,5.5,5.5,6.0,"Centers of AI Acceleration are actionable and support innovation. Somewhat broad, but implementation path is plausible.",2210
42,Encourage Global Adoption of Ethical AI Standards,HPE,Industry (Other),5.6000000000000005,5.5,5.5,5.5,6.0,"Encouraging global adoption of ethical AI standards is broad, but supports international governance. Lacks specificity.",2075
43,Promote a Risk-Based Approach to AI Development,Adobe,Industry (Other),5.6000000000000005,5.5,5.5,5.5,6.0,Risk-based approach to AI development is actionable and aligns with regulatory best practices. Somewhat generic.,2122
44,Foster Partnerships for Resource Sharing,HPE,Industry (Other),5.225,5.0,5.5,5.0,5.5,"Fostering partnerships to share supercomputing resources is actionable, but lacks detail and is not a core IAPS priority.",2170
45,Require publicly available lists of AI training inputs,"International Association of Scientific, Technical and Medical Publishers",Industry Association,5.225,5.0,5.5,5.0,5.5,Publicly available lists of AI training inputs are actionable and support transparency. Implementation may be challenging.,2192
46,Regulate AI applications rather than underlying technology,National Taxpayers Union Foundation,Think Tank,5.225,5.0,5.5,5.0,5.5,Regulating AI applications rather than technology is actionable and aligns with sector-specific regulation. Lacks detail.,2081
47,Ensure human-centric AI development and deployment,Center for AI and Digital Policy,Advocacy Org,5.1,5.0,5.0,5.0,5.5,"Human-centric AI development is a common refrain; some actionable elements (accountability), but mostly broad and aspirational.",2084
48,Invest in AI Research and Development for Defense Applications,"CGI Federal, Inc.",Industry (Other),5.1,5.0,5.0,5.0,5.5,"AI R&D for defense is actionable and relevant, but lacks detail and is largely status quo.",2093
49,Promote Competition and Collaboration Among AI Companies,"CGI Federal, Inc.",Industry (Other),5.1,5.0,5.0,5.0,5.5,"Promoting competition and collaboration is broad, but includes some actionable elements (frameworks, consortia).",2088
50,Support Consortiums for AI Research,HPE,Industry (Other),5.1,5.0,5.0,5.0,5.5,"Supporting AI research consortiums is actionable, but lacks specificity and is largely status quo.",2060
51,Partner with Industry to Create Apprenticeship and Internship Programs,"CGI Federal, Inc.",Industry (Other),5.1,5.0,5.0,5.0,5.5,"Industry apprenticeship/internship programs are actionable, but not a core IAPS focus and lack strategic alignment.",2144
52,Broaden AI Awareness and Skills Training,PSC,Professional Society,5.1,5.0,5.0,5.0,5.5,"Broaden AI awareness and skills training is actionable, but generic and not strategically focused.",2137
53,Position AI Literacy as a National Priority,AI in Education at Oxford University,Academia,5.1,5.0,5.0,5.0,5.5,"AI literacy as a national priority is broad, with some actionable elements. Not a core IAPS focus.",2086
54,Ensure Adequate FDA Staffing and Resources,AdvaMed,Industry Association,5.1,5.0,5.0,5.0,5.5,"Ensuring FDA staffing/resources is actionable, but sector-specific and largely status quo.",2167
55,Create Permanent Medicare Payment Pathways for AI Technologies,AI Healthcare Coalition,Industry Association,5.1,5.0,5.0,5.0,5.5,"Permanent Medicare payment pathways for AI are actionable, but sector-specific and not a core IAPS focus.",2245
56,Provide Financial Incentives for AI Manufacturing Technology Adoption,"Advanced Robotics for Manufacturing
  Institute",Think Tank,4.725,4.5,5.0,4.5,5.0,"Financial incentives for AI manufacturing adoption are actionable, but largely a corporate wish list.",2112
57,Promote AI-powered robotic systems in critical sectors,University of Notre Dame,Academia,4.725,4.5,5.0,4.5,5.0,"Promoting AI-powered robotics in critical sectors is actionable, but generic and not strategically focused.",2091
58,Invest in reproducible research through AI,University of Notre Dame,Academia,4.725,4.5,5.0,4.5,5.0,"Investments in reproducible research through AI are actionable, but not a core IAPS focus and lack specificity.",2133
59,Apply AI for Water Monitoring and Extreme Event Forecasting,University of Vermont,Academia,4.725,4.5,5.0,4.5,5.0,"AI for water monitoring/extreme events is actionable, but sector-specific and not a core IAPS focus.",2106
60,Fund targeted research for electrical infrastructure and battery chemistries,Americans for Responsible Innovation,Advocacy Org,4.725,4.5,5.0,4.5,5.0,"Targeted research for electrical infrastructure/battery chemistries is actionable, but not a core IAPS focus.",2108
61,Exclude AI Services from the OPPS Cap on Imaging Services,AI Healthcare Coalition,Industry Association,4.6,4.5,4.5,4.5,5.0,"Excluding AI services from OPPS cap is sector-specific, self-serving, and not a core IAPS focus.",2153
62,Ensure Market Access for U.S. AI Technology,HPE,Industry (Other),4.45,4.0,4.5,4.5,5.0,"Ensuring market access for US AI is a generic trade ask, with little actionable detail.",2095
63,Avoid Picking Winners,Technology Policy Institute,Think Tank,4.45,4.0,4.5,4.5,5.0,"Avoiding 'picking winners' is a common refrain, with little actionable substance.",2160
64,Improve cybersecurity for AI systems,American Academy of Pediatrics,Professional Society,4.45,4.0,4.5,4.5,5.0,"Improving cybersecurity for AI systems is important, but this proposal is vague and lacks actionable detail.",2151
65,Minimize AI Regulatory Compliance Burdens,National Association of Manufacturers,Industry Association,3.8249999999999997,3.5,4.0,3.5,4.5,"Minimizing AI regulatory compliance burdens is a generic industry ask, with little actionable detail or evidence.",2055
66,Authority to Operate Reciprocity,Vanta,Industry (Other),3.8249999999999997,3.5,4.0,3.5,4.5,"ATO reciprocity is a narrow procurement reform, largely a corporate wish list, and not a core IAPS focus.",2014
67,Create a Centralized AI Procurement Office,"CGI Federal, Inc.",Industry (Other),3.8249999999999997,3.5,4.0,3.5,4.5,Centralized AI procurement office is a bureaucratic solution with little evidence or strategic value.,2035
68,Create programs to offset occupational obsolescence,University of Notre Dame,Academia,3.8249999999999997,3.5,4.0,3.5,4.5,"Programs to offset occupational obsolescence are broad, generic, and lack actionable detail.",2050
69,Support for AI-Driven Accessibility Innovation,International Association of Venue Managers (IAVM),Professional Society,3.325,3.0,3.5,3.0,4.0,"AI-driven accessibility innovation is sector-specific, vague, and not a core IAPS focus.",2054
70,Establish appropriate licensing regime for creators,"International Association of Scientific, Technical and Medical Publishers",Industry Association,2.825,2.5,3.0,2.5,3.5,"Licensing regime for creators is a self-serving industry ask, with little strategic or actionable value.",2008
71,Protect intellectual property in government AI applications,American Chemistry Council,Industry Association,2.825,2.5,3.0,2.5,3.5,"Protecting IP in government AI applications is a narrow, self-serving industry ask.",2009
72,Expand funding for AI education programs and infrastructure,American Council on Education,Academia,2.825,2.5,3.0,2.5,3.5,"Expanding funding for AI education programs is generic, not actionable, and not a core IAPS focus.",2019
73,Develop ML-Assisted Structural Optimization,University of Vermont,Academia,2.325,2.0,2.5,2.0,3.0,"ML-assisted structural optimization is an academic research wish, with no policy path.",2023
74,Expand AI Literacy & Public Awareness,Wahba Institute for Strategic Competition,Think Tank,2.325,2.0,2.5,2.0,3.0,"Expanding AI literacy/public awareness is generic, vague, and not actionable.",2037
75,Aligning Public Sector Procurement with Innovation,Chickasaw Federal,Industry (Other),1.825,1.5,2.0,1.5,2.5,"Public sector procurement alignment is a vague, hand-waving proposal with no actionable content or evidence.",2136
